{
  "$schema": "../../schema.json",
  "bittensor_id": "lambda",
  "letter": "Î»",
  "name": "Dippy Roleplay",
  "github": ["https://github.com/impel-intelligence/dippy-bittensor-subnet"],
  "hw_requirements": "https://github.com/impel-intelligence/dippy-bittensor-subnet/blob/main/min_compute.yml",
  "image_url": "https://github.com/impel-intelligence/dippy-bittensor-subnet/raw/main/assests/banner.png",
  "description": "description.html",
  "bittensor_discord_id": "1232378968187867147",
  "team": "Impel",
  "categories": ["Model Development"],
  "summary": "The Dippy Roleplay subnet on Bittensor aims to create the world's best open-source roleplay LLM by leveraging the collective efforts of the open-source community.",
  "websites": [
    {
      "label": "twitter",
      "url": "https://x.com/dippy_ai"
    },
    {
      "label": "application",
      "url": "https://bittensor.dippy.ai/play"
    }
  ]
}
