{
  "$schema": "../../schema.json",
  "bittensor_id": "",
  "letter": "×“",
  "name": "LOL",
  "github": [""],
  "hw_requirements": "",
  "image_url": "https://assets.backprop.finance/subnet-logos/28/v1.jpg",
  "description": "",
  "bittensor_discord_id": "1343950080465698836",
  "team": "",
  "summary": "",
  "websites": []
}
