{
  "$schema": "../../schema.json",
  "bittensor_id": "",
  "letter": "Ùƒ",
  "name": "",
  "github": [],
  "hw_requirements": "",
  "image_url": "https://assets.backprop.finance/subnet-logos/default.png",
  "description": "",
  "bittensor_discord_id": "1349123085877379112",
  "team": "",
  "summary": "",
  "websites": []
}
