{
  "$schema": "../../schema.json",
  "bittensor_id": "edge_maxxing",
  "letter": "×ž",
  "name": "EdgeMaxxing",
  "github": ["https://github.com/womboai/edge-optimization-subnet"],
  "hw_requirements": "",
  "image_url": "",
  "description": "description.html",
  "bittensor_discord_id": "1241046233800507482",
  "team": "Wombo",
  "summary": "EdgeMaxxing is focused on optimizing AI models for consumer devices, starting with Stable Diffusion XL on the NVIDIA GeForce RTX 4090. By optimizing popular models for edge devices, the subnet aims to transform idle computing resources into valuable contributors to decentralized inference networks.",
  "websites": [
    {
      "label": "twitter",
      "url": "https://x.com/WOMBO"
    },
    {
      "label": "website",
      "url": "https://www.w.ai/"
    },
    {
      "label": "dashboard",
      "url": "https://huggingface.co/spaces/wombo/edge-maxxing-dashboard"
    }
  ]
}
