{
  "$schema": "../../schema.json",
  "bittensor_id": "",
  "letter": "áš¨",
  "name": "vidaio",
  "github": ["https://github.com/vidaio-subnet/vidaio-subnet"],
  "hw_requirements": "",
  "image_url": "https://backprop.finance/assets/subnet-logos/85/v1.jpg",
  "description": "",
  "bittensor_discord_id": "",
  "team": "",
  "summary": "",
  "websites": []
}
