{
  "$schema": "../../schema.json",
  "bittensor_id": "masa",
  "letter": "×¡",
  "name": "Masa",
  "github": ["https://github.com/masa-finance"],
  "hw_requirements": "",
  "image_url": "",
  "description": "description.html",
  "bittensor_discord_id": "1275149537547391058",
  "team": "Masa",
  "summary": "Masa focuses on decentralized data scraping, offering an alternative to traditional centralized services like BrightData and Apify.",
  "websites": [
    {
      "label": "website",
      "url": "https://developers.masa.ai/docs/masa-subnet/welcome"
    },
    {
      "label": "twitter",
      "url": "https://x.com/getmasafi"
    }
  ]
}
