{
  "$schema": "../../schema.json",
  "bittensor_id": "logicnet",
  "letter": "×š",
  "name": "LogicNet",
  "github": ["https://github.com/LogicNet-Subnet/LogicNet"],
  "hw_requirements": "",
  "image_url": "https://backprop.finance/assets/subnet-logos/35/v1.png",
  "description": "description.html",
  "bittensor_discord_id": "1204855126045753434",
  "team": "Logic Net",
  "summary": "LogicNet focuses on developing open-source mathematics and detailed data analysis models.",
  "categories": ["Model Development"],
  "websites": [
    {
      "label": "website",
      "url": "https://tonylvh.notion.site/LogicNet_SN35-1b44e52d308f47e7983af25bff6df90e"
    },
    {
      "label": "dashboard",
      "url": "https://logicnet.streamlit.app/"
    }
  ]
}
