{
  "$schema": "../../schema.json",
  "bittensor_id": "fine_tuning",
  "letter": "×œ",
  "name": "Fine-Tuning",
  "github": ["https://github.com/macrocosm-os/finetuning"],
  "hw_requirements": "",
  "image_url": "",
  "description": "description.html",
  "bittensor_discord_id": "1253448873305964626",
  "team": "Macrocosmos",
  "summary": "Fine-Tuning is focused on the production of fine-tuned models. Contributors are rewarded based on their models' head-to-head scores, with evaluations based on a continuous stream of synthetic data generated by the top LLMs. The evaluation data setup helps reduce the potential of the benchmark being gamed.",
  "categories": ["Model Development", "Macrocosmos"],
  "websites": [
    {
      "label": "twitter",
      "url": "https://x.com/MacrocosmosAI"
    },
    {
      "label": "website",
      "url": "https://www.macrocosmos.ai/sn37"
    },
    {
      "label": "dashboard",
      "url": "https://www.macrocosmos.ai/sn37/dashboard"
    }
  ]
}
