{
  "$schema": "../../schema.json",
  "bittensor_id": "",
  "letter": "Ù…",
  "name": "Hippius",
  "github": [
    "https://github.com/thenervelab/hippius-cli",
    "https://github.com/thenervelab/hippius-network-mesh-config"
  ],
  "hw_requirements": "",
  "image_url": "https://backprop.finance/assets/subnet-logos/75/v1.jpg",
  "description": "",
  "bittensor_discord_id": "1349124437752152075",
  "team": "",
  "summary": "",
  "categories": ["Storage"],
  "websites": [
    {
      "label": "twitter",
      "url": "https://x.com/hippius_subnet"
    },
    {
      "label": "website",
      "url": "https://hippius.com"
    },
    {
      "label": "discord",
      "url": "https://discord.hippius.com"
    }
  ]
}
