{
  "$schema": "../../schema.json",
  "bittensor_id": "",
  "letter": "",
  "name": "NullUntilBoot",
  "github": ["https://github.com/NeuralNexusII/NullUntilBoot"],
  "hw_requirements": "",
  "image_url": "https://backprop.finance/assets/subnet-logos/default.png",
  "description": "",
  "bittensor_discord_id": "1361421560988041267",
  "team": "",
  "summary": "",
  "categories": [],
  "websites": [
    {
      "label": "twitter",
      "url": "https://x.com/NullUntilBoot"
    }
  ]
}
